"1","0","Статьи","main","list","0",,,,,,,"2201","0",,"1310222730","1421321183"
"2","6","Это должен знать каждый","Eto_dolzhen_znat_kazhdyj","default","1","<strong>Есть 4 основных фактора, которые необходимо знать, если вы ХОТИТЕ СПАСТИСЬ ПРИ ПОЖАРЕ</strong>","
<p align=""center""><strong>Есть 4 основных фактора, которые необходимо знать, если вы ХОТИТЕ СПАСТИСЬ ПРИ ПОЖАРЕ:</strong></p> 
<ul> 
  <li>Будьте готовы к тому, что пожар ослепляет и вы не сможете видеть в огне или дыму . Не паникуйте!; </li> 
  <li>Убивает, в первую очередь, дым , поэтому пользуйтесь любыми подручными средствами для защиты органов дыхания; </li> 
  <li>Жар от огня настолько силен, что способен вызвать гибель. Помните, чем ближе к полу, тем он слабее; </li> 
  <li>Пожар не оставляет времени. Надо успеть выбраться из огня, через 1 минуту он становится неуправляем.</li> 
</ul> 
<p>Телефон Единой службы спасения 01 </p> 
<p>&nbsp;</p><hr id=""null"" /> 
<p>&nbsp;</p> 
<ul> 
  <li>Вы увидели бесхозные пакеты и свертки не проходите равнодушно мимо. В каждом из них может находиться взрывчатое вещество. Немедленно сообщите об этом в Службу спасения по телефону 01. До прибытия спасателей не трогайте подозрительные предметы. </li> 
  <li>Надежно закрывайте подъезды, подвалы и чердаки. Это не даст шансов террористам проникнуть в ваши дома, нарушить покой диверсиями и взрывами. Обо всех подозрительных случаях сообщайте в службу спасения по телефону 01. </li> 
  <li>Неосторожное обращение с огнем ведет к пожарам. Не подвергайте себя опасности. Не курите лежа в постели. Не пользуйтесь самодельными обогревателями. Следите за чистотой дымоходов, исправностью газового оборудования и электропроводки. Заметив пламя и дым, звоните в службу спасения 01. </li> 
  <li>Для оповещения населения при чрезвычайных обстоятельствах вводятся специальные сигналы. Услышав сигнал &laquo;Внимание всем!&raquo;, а это заводские гудки и сирены, необходимо включить радиоприемник, радио, телевизор, другие средства связи и прослушать поступающие по ним информационные сообщения о случившемся и рекомендации по дальнейшим действиям. Речевым сообщением передаются также сигналы &laquo;Воздушная тревога!&raquo;, &laquo;Радиационная опасность!&raquo;, &laquo;Химическая тревога!&raquo;. Внимательно слушайте характер сообщений, соблюдайте меры безопасности. </li> 
  <li>Соблюдайте правила купания в открытых водоемах. Не ныряйте в незнакомых, необорудованных для этого местах. Знайте, где находятся на пляжах спасатели, телефонная связь для вызова милиции и медиков. Требуйте от местной администрации ограждения мест для купания взрослых и детей. Заметив утопающего, примите меры для его спасения. Не допускайте шалости на воде! </li> 
  <li>Шалость с огнем приводит к гибели и травматизму детей. Не оставляйте их без присмотра. Прячьте от малышей спички, легковоспламеняющиеся вещества, курительные принадлежности. Храните в надежных местах петарды, хлопушки и другую пиротехнику для новогодних праздников. Не разрешайте пользоваться ею детям, подросткам без ведома взрослых, не по назначению. </li> 
  <li>Неумелое обращение с газовым оборудованием ведет к плачевным последствиям. Соблюдайте правила пользования газовыми приборами, пожарной безопасности. Не пользуйтесь газом для обогрева помещений. Не оставляйте без присмотра приготовление пищи на газовых плитах. Не сушите над ними белье. В случае обнаружения по резкому запаху утечки газа в помещении, не включайте свет, проветрите жилище, вызывайте по телефону 04 аварийную газовую службу или обращайтесь за помощью к спасателям по телефону 01. </li> 
  <li>Будьте осторожны на льду водоемов. Помните, самый прочный лед &ndash; голубого цвета. Серый цвет говорит о присутствии в нем воды, а значит его ненадежности. Умейте оказать помощь провалившемуся под лед. Приближаться к полынье можно только ползком. Не приближайтесь к краю полыньи. За 3-4 метра бросьте пострадавшему веревку, связанные ремни, шарфы, лыжи или палки. Не допускайте охлаждения организма пострадавшего. Дайте ему, по возможности, горячее питье. Постарайтесь побыстрее доставить его в теплое помещение. </li> 
  <li>Если вы стали свидетелем обрушения здания или иного сооружения, не подходите к опасному месту и не допускайте к нему других. Будьте предельно внимательны! Может произойти дальнейшее обрушение конструкций, обрыв линий электропередач, падение деревьев. Немедленно сообщите о случившемся спасателям по телефону 01. </li> 
</ul>",,,,,"3532","10",,"1310222917","1310366344"
