"31","6","ПАМЯТКА при купании в водоемах во время празднования Крещения","Pamyatka_pri_kupanii_v_vodoemah_vo_vremya_prazdnovaniya_Kreweniya_Gospodnya","default","1",,"<p align=""center""><b style=""font-size: 9pt;"">Историческая справка</b></p>
<p style=""text-align: justify;"">Крещение Господне - один из великих праздников православной церкви, в России он традиционно сопровождается купанием в проруби. С Крещением Руси (в 988 году) она постепенно распространилась и среди наших предков. Водоосвящение, может совершать только священник - чтением соответствующих молитв и троекратным погружением креста в воду. На водоемах для этого заранее делается прорубь - &quot;Иордань&quot; - как правило, в форме креста, хотя многие делают проруби прямоугольной формы. Обычно водоемы - пруды, реки, озера освящаются в сам праздник Крещения, после литургии. Крещенская вода - это святыня, которую употребляют для исцеления и для укрепления душевных и телесных сил нас и наших близких и родных.</p>
<p style=""text-align: justify;"">Из некоторых храмов и в Крещенский сочельник после службы совершаются торжественные процессии к прорубям на водоемах, они освящаются. Православные зачерпывают в этой проруби святую воду, умываются ею, а самые отважные &laquo;ныряют&raquo; в прорубь. Российские традиции купания в проруби восходят к временам древних скифов, которые окунали своих младенцев в ледяную воду, приучая их к суровой природе.</p>
<p style=""text-align: justify;"">Ежегодно в городах и селах России специально на реках в преддверии Праздника Крещения специально вырубаются на реках и оборудуются проруби для массового купания верующих. Нет жестких правил, как надо купаться (окунаться) в проруби на Крещение и как оборудовать &laquo;Иордань&raquo;.</p>
<p style=""text-align: justify;"">Как правило, купание представляет собой троекратное погружение в воду с головой. При этом верующий крестится и произносит &quot;Во имя Отца, и Сына, и Святого Духа!&quot; На Руси издревле считается, что купание на Крещение способствует исцелению от различных недугов. Вода - живая материя. Она имеет способность изменять свою структуру под воздействием на нее источника информации. Потому с какими мыслями к ней подойдешь, то и получишь. Чтобы окунуться в холодную воду, специальной подготовки не требуется. Человеческое тело приспособлено испытывать частое воздействие холода. Необходим только настрой.</p>
<p style=""text-align: justify;"">На территории Костромской области накануне праздника традиционно организуются крещенские купели на реках Волга, Кострома, Унжа, Ветлуга, Нея, озерах Галичское и Чухломское. Для жителей г.Костромы, по сложившейся традиции, &laquo;иордани&raquo; будут вырублены на р. Волга, Ребровка (парк &laquo;Берендеевка&raquo;). На всех объектах в ночь с 18 на 19 января и весь день в Крещение сотрудниками МЧС, аварийно- спасательных формирований и УМВД Костромской области будут проводить мероприятия, связанные с обеспечением безопасности людей. Также будет организовано дежурство бригад &laquo;скорой помощи&raquo;.</p>
<p style=""text-align: justify;"">В целях обеспечения безопасности граждан организаторам омовений и костромичам&nbsp;<span style=""font-size: 9pt;"">&nbsp;</span><span style=""font-size: 9pt;"">рекомендуется&nbsp;</span><span style=""font-size: 9pt;"">принять меры безопасности. </span><span style=""font-size: 9pt;"">Погружение в прорубь один раз в году - сильнейший стресс для организма. Для тех, кто планирует на Крещенский Сочельник купаться в проруби, необходимоя соблюдать меры безопасности.</span></p>
<p>&nbsp;</p>
<p align=""center"" style=""text-align: center;""><b>Правила купания (омовения) в проруби</b></p>
<p style=""text-align: justify;"">1. Окунаться (купаться) следует в специально оборудованных прорубях у берега, желательно вблизи спасательных станций, под присмотром спасателей.</p>
<p style=""text-align: justify;"">2. Перед купанием в проруби необходимо разогреть тело, сделав разминку, пробежку.</p>
<p style=""text-align: justify;"">3. К проруби необходимо подходить в удобной, не скользкой и легкоснимаемой обуви, чтобы предотвратить потери чувствительности ног. Лучше использовать ботинки или шерстяные носки для того, чтобы дойти до проруби. Возможно использование специальных резиновых тапочек, которые также защищают ноги от острых камней и соли, а также не дадут Вам скользить на льду. Идя к проруби, помните, что дорожка может быть скользкой. Идите медленно и внимательно.</p>
<p style=""text-align: justify;"">4. Окунаться лучше всего по шею, не замочив голову, чтобы избежать рефлекторного сужения сосудов головного мозга; Никогда не ныряйте в прорубь вперед головой. Прыжки в воду и погружение в воду с головой не рекомендуются, так как это увеличивает потерю температуры и может привести шоку от &nbsp;холода.</p>
<p style=""text-align: justify;"">5. При входе в воду первый раз старайтесь быстро достигнуть нужной Вам глубины, но не плавайте. Помните, что холодная вода может вызвать совершенно нормальное безопасное учащенное дыхание. Как только Ваше тело приспособилось к холоду.</p>
<p style=""text-align: justify;"">6. Не находиться в проруби более 1 минуты во избежание общего переохлаждения организма.</p>
<p style=""text-align: justify;"">7. После купания (омовения) разотрите себя махровым полотенцем и наденьте сухую одежду.</p>
<div style=""text-align: justify;""><span style=""font-size: 9pt;"">8. Для укрепления иммунитета и возможности переохлаждения необходимо выпить горячий чай, лучше всего из ягод, фруктов и овощей из предварительно подготовленного термоса.</span></div>",,,,,"3235","91",,"1359458213","1412584543"
"32","6","ПАМЯТКА при передвижении по ледовым переправам","Pamyatka_pri_peredvizhenii_po_ledovym_perepravam","default","0",,"<p style=""text-align: justify;"">Ледовые переправы выполнены с установкой настила из деревянного горбыля и лежневой дороги, с дополнительным намораживанием льда. &nbsp;Толщина льда на ледовой переправе зависит от грузоподъемности автотранспорта, чем тяжелей вес автомобиля, тем больше должна быть толщина льда. Обычно толщина льда составляет примерно от 50-70 см.&nbsp;Данные переправы самые надежные и могут эксплуатироваться практически до апреля. После строительства каждая переправа подвергается испытаниям на прочность и безопасность, проходит техническое освидетельствование. Только после того, как эксперты признают ледяную дорогу пригодной к эксплуатации, она может использоваться для передвижения людей, для проезда транспорта, перевозки леса, для решения социальных проблем населения, проживающего на противоположном берегу реки.&nbsp;</p>
<p style=""text-align: justify;""><b>При передвижении по ледовым переправам необходимо соблюдать основные правила:</b></p>
<p style=""text-align: justify;""><!--[if !supportLists]-->1. Выезжать на лёд нужно медленно, без толчков и торможений, со скоростью не более 10 км/час.&nbsp;</p>
<p style=""text-align: justify;""><!--[if !supportLists]-->2. Перед выездом на лёд необходимо отстегнуть ремни безопасности.&nbsp;</p>
<p style=""text-align: justify;""><!--[if !supportLists]-->3.&nbsp;На ледовой переправе запрещено допускать остановки, рывки, развороты, обгоны автомобилей и заправку их горючим.</p>
<p style=""text-align: justify;""><!--[if !supportLists]-->4. Нельзя допускать нагрузки, превышающие грузоподъемность льда.&nbsp;</p>
<p style=""text-align: justify;""><!--[if !supportLists]-->5. Перемещение транспортных средств при плохой видимости (туман или пурга) осуществлять не рекомендуется.&nbsp;</p>
<p align=""left"" style=""text-align: justify;""><b>Если все же Ваш автомобиль оказался в воде, то необходимо:&nbsp;</b></p>
<p align=""left"" style=""text-align: justify;"">- немедленно покинуть машину, пока она держится на плаву, через боковые окна; двери желательно не открывать, так как машина быстрее пойдет ко дну;&nbsp;</p>
<p align=""left"" style=""text-align: justify;"">- если автомобиль ушел под воду, то перед тем как покинуть машину, сделайте несколько глубоких вдохов и выбирайтесь из автомобиля; по возможности избавьтесь от &laquo;тяжелой&raquo; одежды (обуви, пальто, куртки);&nbsp;</p>
<p align=""left"" style=""text-align: justify;"">- если с Вами оказался ребенок, прижмите его спиной к себе, закройте ему нос и рот ладонью, и всплывайте.&nbsp;</p>
<div style=""text-align: justify;""><span style=""font-size: 9pt;"">Управление по защите населения от чрезвычайных ситуаций на территории Костромской области напоминает жителям региона о необходимости соблюдения основных правил при передвижении по ледовым переправам и об опасности движения на транспортных средствах через несанкционированные ледовые переправы. Ведь один раз, сократив путь, Вы можете оборвать жизнь себе или своим близким.</span></div>",,,,,"3128","92",,"1359459593","1412584578"
